{
  "$schema": "http://json-schema.org/draft-07/schema#",
  "title": "Project Brief Schema",
  "type": "object",
  "required": [
    "id",
    "version",
    "stakeholders",
    "successCriteria",
    "scope",
    "nonFunctional"
  ],
  "properties": {
    "id": {
      "type": "string",
      "description": "Unique identifier for the brief"
    },
    "version": {
      "type": "string",
      "pattern": "^\\d+\\.\\d+\\.\\d+$",
      "description": "Semantic version of the brief"
    },
    "stakeholders": {
      "type": "array",
      "items": {
        "type": "object",
        "required": [
          "name",
          "role",
          "concerns"
        ],
        "properties": {
          "name": {
            "type": "string"
          },
          "role": {
            "type": "string"
          },
          "concerns": {
            "type": "array",
            "items": {
              "type": "string"
            }
          }
        }
      }
    },
    "successCriteria": {
      "type": "array",
      "items": {
        "type": "string"
      },
      "minItems": 1
    },
    "scope": {
      "type": "object",
      "required": [
        "included",
        "excluded"
      ],
      "properties": {
        "included": {
          "type": "array",
          "items": {
            "type": "string"
          }
        },
        "excluded": {
          "type": "array",
          "items": {
            "type": "string"
          }
        }
      }
    },
    "nonFunctional": {
      "type": "object",
      "properties": {
        "performance": {
          "type": "array",
          "items": {
            "type": "string"
          }
        },
        "security": {
          "type": "array",
          "items": {
            "type": "string"
          }
        },
        "scalability": {
          "type": "array",
          "items": {
            "type": "string"
          }
        },
        "maintainability": {
          "type": "array",
          "items": {
            "type": "string"
          }
        }
      }
    }
  }
}